title;author;content
Pajang dan Iklan Rokok Dilarang di Toko-toko Ritel di Depok;Cynthia Lova;"DEPOK, KOMPAS.com -  Pemerintah Kota Depok telah menerbitkan larangan memajang ( display)  rokok dan iklan rokok di toko-toko ritel di daerah itu sejak 19 September lalu.Kepala Satuan Polisi Pamong Praja (Satpol PP) Kota Depok, Yayan Arianto menyebutkan, 374 toko ritel di Depok  mulai dari supermarket, minimarket, dan pusat-pusat perbelanjaan sudah diberi surat edaran terkait larangan  display  dan promosi rokok di tempat usaha mereka.Namun masih banyak toko ritel di Depok yang memajang rokok. Poster-poster rokok pun masih terlihat di beberapa tempat.Yayan mengatakan, tangal 24 Oktober hingga 25 Oktober ada 105 ritel di 11 Kecamatan yang sudah dilakukan pembinaan dan pengawasan.“Selama dua hari kemarin kami lakukan pengawasan, hasilnya adalah masih ada 62 ritel yang men- display  rokok,” kata Yayan di Balai Kota Depok, Jalan Margonda, Jumat (26/10/2018).Baca juga:  Pergub Larangan Iklan Rokok Dalam Ruangan Dinilai Belum DiterapkanYayan menambahkan, 70 ritel di Kota Depok masih memasang iklan rokok di depan toko ritel mereka.“Ada 35 ritel yang masih mempromosikan rokok dan ada 23 ritel yang ada tulisan ‘tersedia rokok’,” ujar Yayan.Ia mengatakan, hanya 24 toko ritel yang menaati peraturan untuk tidak memajang rokok ataupun memasang iklan rokok.“Sampai saat ini emang masih rendah yang menaati peraturan padahal surat edaran telah diberikan, kami memang masih pengawasan saja, belum sampai memberikan sanksi,” ucap Yayan.Yayan mengatakan, pihaknya memberi waktu dua minggu bagi para pelaku usaha, pengelola atau penanggung jawab, untuk mencabut dan membersihkan semua  display  dan promosi rokok dari tempat usaha mereka.""Setelah dua minggu barulah, kami monitor kembali. Jika masih ada  display  iklan rokok terpasang akan langsung kami tertibkan dan layangkan sanksi,"" kata Yayan.Ia mengatakan, sanksi akan berdasarkan Perda Kota Depok Nomor 3 Tahun 2014 tentang Kawasan Tanpa Rokok (KTR).""Di Pasal 44 disebutkan, sanksi untuk perorangan adalah kurungan paling lama 7 hari, atau denda maksimal Rp 1 Juta. Sementara untuk badan atau lembaga, sanksinya adalah kurungan paling lama 3 bulan atau denda maksimal Rp 50 Juta. Untuk badan usaha atau lembaga, dapat dikenakan pidana tambahan berupa pencabutan izin usaha,"" ujar Yayan.Surat edaran Wali Kota Depok Mohammad Idris terkait Larangan Display Penjualan Rokok, Mengiklankan dan Mempromosikan Rokok ditujukan kepada para pelaku, pengelola, penanggung jawab usaha se-Kota Depok."
Negara Bagian New York Tuntut Exxon Mobil, Ini Sebabnya...;Veronika Yasinta;"NEW YORK  CITY, KOMPAS.com  - Jaksa Agung   New York  mengajukan gugatan terhadap perusahaan Exxon Mobil atas dugaan menipu investor.Gugatan atas nama Jaksa Agung New York Barbara Underwood itu menuding, Exxon menyesatkan investor dengan meyakinkan mereka bahwa perusahaan sudah memasukkan risiko pengetatan regulasi   perubahan iklim  dalam perencanaan bisnisnya.""Exxon menipu investor agar percaya, perusahaan itu telah mengelola risiko peraturan perubahan iklim di masa depan pad bisnisnya,"" ungkap kantor jaksa agung, seperti diwartakan  ABC News , Kamis (25/10/2018).Baca juga:  Exxon Investasi 100 Juta Dollar AS Kembangkan Lapangan Kedung KerisTuntutan juga mencakup klaim tentang mantan CEO   ExxonMobil  Rex Tillerson yang mengetahui tentang hal tersebut.Sebagai informasi, Tillerson pernah menjabat sebagai menteri luar negeri AS di bawah pemerintahan Donald Trump.""Manajemen Exxon, termasuk mantan CEO Rex W Tillerson mengetahui selama beberapa tahun mengenai perusahaan yang menyembunyikan hal itu dari publik,"" imbuh pernyaataan kantor jaksa.Melansir  AFP , manajemen Exxon Mobil menyatakan kepada investor bahwa perusahaan menghadapi risiko kecil terhadap kebijakan iklim yang lebih agresif.Sebagai hasilnya, Exxon Mobil mengecilkan biaya terkait proyek   minyak  di Kanada lebih dari 25 miliar dollar AS atau Rp 380,5 miliar.Gugatan diajukan menyusul menyusul penyelidikan tiga tahun oleh mantan Jaksa Agung New York Eric Schneiderman dan dilanjutkan oleh Underwood.Exxon Mobil menepis tuduhan dengan menyebutnya sebagai tindakan tidak berdasar dan produk dari aktivis bahan bakar fosil.Baca juga:  193 Tahun Lalu Kanal Erie Diresmikan, New York Ikut Berkembang Pesat""Kantor Jaksa Agung New York menggandakan penyelidikannya yang tercemar dan tidak berguna dengan mengajukan pengaduan terhadap Exxon Mobil,"" kata juru bicara itu dalam sebuah pernyataan.""Tuduhan tak berdasar ini merupakan produk lobi p oleh kepentingan khusus, oportunis politik, dan ketidakmampuan jaksa agung untuk mengakui penyelidikan tiga tahuntidak menemukan kesalahan,"" imbuhnya.Pada Juli lalu, seorang hakim AS membatalkann gugatan Negara Bagian New York kepada Exxon Mobil dan empat perusahaan minyak lain karena berkontribusi terhadap perubahan iklim."
Jadi Plh Bupati Cirebon, Ini Langkah Pertama Rahmat Sutrisno;Kontributor Bandung, Dendi Ramdhani;"BANDUNG, KOMPAS.com  - Sekretaris Daerah Kabupaten   Cirebon  Rahmat Sutrisno resmi menjabat sebagai Pelaksana Harian (  Plh )   Bupati  Cirebon.Rahmat menggantikan Bupati Cirebon Sunjaya Purwadisastra yang telah ditetapkan sebagai tersangka oleh Komisi Pemberantasan Korupsi (KPK) terkait jual beli jabatan.Surat tugas Rahmat diserahkan oleh Wakil Gubernur Jawa Barat Uu Ruzhanul Ulum di Gedung Sate, Jalan Diponegoro, Jumat (25/10/2018).Rahmat mengatakan, salah satu program yang akan ia prioritaskan yakni menyusun   APBD  tahun 2019 yang saat ini baru memasuki tahap pembahasan. Langkah itu dinilai penting guna menjamin pembangunan daerah tetap berjalan.""Jadi terima kasih kepada Pak Wagub tadi amanatnya banyak banget, kayaknya bebannya semakin besar. Pertama prioritas di Kabupaten Cirebon sekarang kita sedang memasuki pembahasan anggaran 2019,"" ungkap Rahmat.Baca juga:  Ini Sosok Sunjaya Purwadisastra, Bupati Cirebon yang Ditangkap KPKSelama pembahasan APBD berlangsung, Rahmat mengaku akan terus berkonsultasi dengan Pemprov Jabar untuk memastikan segala keputusannya sesuai aturan yang diamanatkan perundang-undangan.""Kalau lihat di UU 23 tahun 2014 tentang pemerintah daerah, ada tugas kewenangan kewajiban dan hak kepala daerah. Saya mungkin hanya ada pada bagian tugas ketika nanti RAPBD telah disepakati bersama dengan Banggar, maka itu harus ada persetujuan bersama. Persetujuan bersama itulah menjadi ruang kewenangan. Nah ini perlu dikonsultasikan kepada Pemprov Jabar,"" tutur Rahmat.Rahmat juga mengaku telah membaca surat keputusan Kemendagri di mana terdapat beberapa poin larangan selama ia menjadi Plh Bupati Cirebon.""Tadi juga saya baca sepintas dari (surat) Pak Mendagri ada hal yang dilarang, pertama kebijakan strategis yang menyangkut anggaran, personel dan seterusnya. Jadi ini tetap harus dikomunikasikan dengan Pemprov Jabar. Supaya kami tak salah menggambil langkah,"" paparnya.Sebab itu, kata Rahmat, proses seleksi jabatan yang saat ini berlangsung akan dihentikan sementara hingga mendapat arahan lanjutan.Saat ini, kata Rahmat, ada empat jabatan setingkat kepala dinas yang masih kosong. Diantaranya, Kesbang, Sekretaris Dewan, Dinas Keluarga Berencana dan Perlindungan Anak, dan staf ahli.""Memang ada beberapa hal yang perlu kami pertimbangkan salah satu contoh kami sudah berjalan menuju pelaksanaan seleksi jabatan tinggi pratama. Mungkin itu nanti atas petunjuk dan konsultasi dengan Pemprov Jabar, mungkin kita akan tangguhkan dulu sementara,"" ucapnya.Selain itu, ia pun sudah berkomunikasi dengan unsur pimpinan daerah untuk memastikan kondusivitas masyarakat serta stabilitas pemerintahan.""Insya Allah kami sudah bicarakan dengan pimpinan daerah, Pak Dandim, Pak Kapolres dan Pengadilan Negeri, insya Allah siap untuk melaksanakan pemerintahan pembangunan kemasyarakatan. Memang kami perlu stabilitas,"" jelasnya."
Kabareskrim: Kami Masih Cari Jejak Digital Pelaku dan Pengunggah Video Pembakaran Bendera;Christoforus Ristianto;"JAKARTA, KOMPAS.com  - Kepala Badan Reserse Kriminal Kepolisian RI (Kabareskrim   Polri ) Komjen Pol Arief Sulistyanto menyatakan penyidik masih mencari jejak digital dari tersangka berinisial US (34), pembawa bendera Hizbut Thahrir Indonesia (HTI) dalam peringatan Hari Santri Nasional (HSN), 22 Oktober 2018 lalu."" Handphone  yang ditemukan ini masih baru. Dia (US) sudah ganti  handphone  sejak 24 Oktober kemarin. Mungkin ia jual ketika kasus ramai,"" kata Arief.Kemudian, lanjut Arief, hasil dari jejak digital tersebut bisa menjadi bahan penelusuran penyidik dalam mengonstruksi hubugan US dengan HTI.""Untuk melengkapi alat-alat bukti dan profil US,"" paparnya.Baca juga:  Bupati: Jangan Khawatir, Garut Aman Pasca-Kasus BenderaTak hanya jejak digital pelaku, seperti diungkapkan Arief, penyidik masih mencari orang yang pertama kali mengunggah video pembakaran tersebut sehingga di viral media sosial.Menurutnya, siapa pun yang memenuhi unsur pidana dan perbuatan melawan hukum dalam HSN tersebut akan dipidanakan.""Kami masih dalami jejak digital juga siapa yang  upload  pertama kali,"" imbuhnya.Di sisi lain, guna menerangkan ragam silang pendapat yang terjadi di masyarakat, Arief mengemukakan bahwa kepolisian akan menyampaikan informasi yang akurat dalam forum yang lebih tinggi."
Jalan Panjang Kasus Frantinus Nirigi (2);Kontributor Pontianak, Yohanes Kurnia Irawan;"PONTIANAK, KOMPAS.com-  Kesaksian dari Cindy kemudian dibantah langsung oleh terdakwa Frantinus usai memberikan kesaksian. Menurut FN, ada beberapa kesaksian Cindy yang menurutnya tidak benar.FN mengungkapkan saat itu dirinya baru tiba dan duduk di kursi sambil memangku tas yang dibawanya. Dia juga mengatakan bahwa saat itu tidak dalam kondisi sedang kebingungan.    Cindy kemudian datang menghampirinya dan meminta untuk meletakkan barang di tempat bagasi. Usai meletakkan barang miliknya, FN kemudian duduk kembali.     Dia kemudian melihat Cindy memasukkan tas miliknya itu dengan kasar tepat di tempat bagasi yang ada di atas tempat duduknya saat itu.    ""Saya bilang, awas Bu, ada tiga laptop disitu. Tidak ada bilang bom,"" ujar FN dengan logat kental khas Papua.Baca juga:  Jalan Panjang Kasus Frantinus Nirigi (1)    Bahkan majelis hakim juga terlihat mengernyitkan dahi untuk mendengarkan dan memastikan kalimat yang diucapkan FN dengan logat kental Papua tersebut.    ""Jadi intinya, saudara tidak ada bilang 'awas ada bom', tapi 'awas bu', ya,"" tanya ketua majelis hakim, I Komang Dediek Prayoga kepada FN untuk meyakinkan.     Dituntut 8 Bulan    Jaksa penuntut umum Kejari Mempawah mengajukan tuntutan 8 bulan penjara terhadap terdakwa   Frantinus Nirigi  (FN) dalam sidang lanjutan kasus candaan bom dalam pesawat Lion Air JT 687 yang digelar di Pengadilan Negeri Mempawah, Kamis (4/10/2018) sore.    Tuntutan tersebut dibacakan oleh Erik Cahyo dalam sidang yang dihadiri oleh majelis hakim, terdakwa dan kuasa hukum terdakwa.     Dalam tuntutannya, Erik menyebutkan bahwa dakwaan bersifat subsidair, yaitu menyampaikan informasi palsu yang membahayakan keselamatan penerbangan sebagaimana diatur dan diancam pidana dalam pasal 437 Ayat 1 UU Rl No 1 tahun 2009 tentang Penerbangan.    Dalam dakwaan subsidiair tersebut, seperti dibacakan Erik, terdakwa juga memenuhi unsur-unsur setiap orang dan menyampaikan informasi palsu yang membahayakan keselamatan penerbangan."
Gubernur ke Argentina, Sekda DKI Akan Jadi Plh;Jessi Carina;"JAKARTA, KOMPAS.com -  Sekretaris Daerah DKI Jakarta Saefullah akan menjadi Pelaksana Harian (Plh) Gubernur DKI Jakarta selama beberapa hari. Pasalnya, Gubernur DKI Jakarta Anies Baswedan akan pergi ke Argentina, Sabtu (27/10/2018) besok.""Plh nanti adalah Pak Sekda,"" ujar Kepala Biro Kepala Daerah dan Kerjasama Luar Negeri (KDH-KLN) DKI Jakarta Mawardi ketika dihubungi, Jumat.Anies akan ke Argentina pada Sabtu dini hari. Rencananya Anies akan berada di Jakarta lagi pada 2 November.Anies ke Argentina untuk mengikuti kegiatan G20.Baca juga:  Sabtu Besok, Gubernur DKI Berangkat ke Argentina Ikuti Kegiatan G20""Jadi nanti masing-masing wali kota di dunia akan memaparkan sesuai dengan temanya, nanti hasil dari semua itu akan menjadi semacam rekomendasi,"" ujar Mawardi.Rencananya, Anies tidak akan mengajak kepala Satuan Kerja Perangkat Daerah (SKPD) untuk ikut ke Argentina. Dia hanya pergi dengan kepala bidang di Badan Perencanaan Pembangunan Daerah (Bappeda) dan staf Biro KDH-KLN."
Gagal Cegat Pengiriman Narkoba, Duterte Pecat Kepala Bea Cukainya;Ardi Priyatno Utomo;"MANILA, KOMPAS.com  - Presiden Filipina   Rodrigo Duterte  mengumumkan pemecatan terhadap kepala badan   bea cukai  Isidro Lapena, dan memerintahkan perombakan di seluruh jajaran petingginya.Dilaporkan  Al Jazeera  Jumat (26/10/2018), pemecatan itu terjadi setelah Lapena dan jajarannya dianggap gagal menghentikan pengiriman lebih dari satu ton   narkoba.Baca juga:  Duterte: Saya Tidak Takut pada Kematian""Komisioner keluar. Kepala departemen juga keluar,"" ujar Duterte ketika menghadiri upacara peringatan berdirinya penjaga pantai Filipina.Lapena nantinya bakal dipindahkan menjadi direktur jenderal badan pelatihan Filipina. Sebuah jabatan yang disebut Duterte ""promosi"".Sebagai pengganti Lapena, presiden berjuluk The Punisher itu mengangkat kepala Otoritas Industri Maritim Filipina Rey Guerrero.Nantinya, Guerrero bakal dibantu tentara serta anggota penjaga pantai. Duterte berkata dia bisa memahami jika Guerrero enggan menerimanya.""Saya tahu Anda suka berada di Marina. Namun, saat ini rakyat meminta seorang pria jujur menempati jabatan itu. Semoga berhasil,"" kata Duterte.Lapena yang juga hadir dalam upacara tersebut mengaku terkejut dengan keputusan pemecatan itu. Namun, dia berterima kasih kepada Duterte atas posisi barunya.Pensiunan jenderal polisi tersebut berada dalam tekanan sejak jajarannya gagal mendeteksi adanya penyelundupan methamphetamines Juli lalu.Badan anti-narkoba Filipina menemukan kontainer yang digunakan untuk menyelundupkan methamphetamines. Namun barangnya dilaporkan sudah tidak ada.Digong, sapaan akrab Duterte, telah mencanangkan perang terhadap narkoba sejak terpilih sebagai orang nomor satu Filipina Juni 2016.Lebih dari 4.200 orang tersangka pengedar narkoba tewas dalam baku tembak melawan polisi. Tingginya korban tewas mendapat perhatian khusus aktivis HAM hingga PBB.Baca juga:  Duterte: Dosa Saya Hanyalah Pembunuhan Esktrayudisial"
PDI-P Instruksikan Calegnya Tiru Cara Kampanye Jokowi agar Terpilih;Rakhmat Nur Hakim;"JAKARTA, KOMPAS.com  - Sekretaris Jenderal PDI-P Hasto Ksristiyanto menginstruksikan para calon anggota legislatif (  caleg ) dari partainya meniru gaya   kampanye  Presiden Joko Widodo jika ingin terpilih.Hal itu disampaikan Hasto di hadapan peserta Pembekalan Gelombang I untuk Calon Anggota Legislatif (  Caleg ) DPR RI Pemilu Tahun 2019 yang digelar di Wisma Kinasih, Bogor, Kamis (25/10/2018) malam.Hasto menceritakan pengalaman Presiden Jokowi ketika ditanya resep kemenangan di pilkada dan pilpres. Kata Hasto, jurusnya hanya satu yakni salaman dengan masyarakat."" The power of  salaman. Dan kebiasaan beliau ini tak habis ketika beliau jadi presiden sekalipun. Maka Anda pun harus bisa mengikuti demikian saat datang ke rumah-rumah,"" kata Hasto melalui keterangan tertulis, Jumat (26/10/2018).Baca juga:  Golkar Akan Ganti Dana Kampanye CalegHasto mengakui tak mudah menjadi caleg di pemilu dengan nuansa politik yang liberal seperti saat ini. Namun, ia mengingatkan para caleg agar memiliki disiplin dan loyalitas.Hasto pun menceritakan pengalaman Ketua Umum PDI-P Megawati Soekarnoputri yang di masa lalu selalu dihambat rezim Orde Baru.""Bu Mega dalam masa sulit pernah berkampanye di Demak. Tidak ada yang berani datang, paling hanya 50 orang. Saat itu loyalis Bu Mega hanya berani mendengar pidato dari balik pintu dan jendela rumahnya. Itulah perjuangan dan proses jadi pemimpin. Jangan kecil hati,"" kata Hasto.""Mari kita tingkatkan kerja sama politik di antara kita. Berbagai persoalan di lapangan adalah gemblengan yang harus dilalui setiap kader Partai,” lanjut dia."
Bawaslu DKI Putuskan Videotron Jokowi-Ma'ruf Langgar Administrasi Pemilu;Ardito Ramadhan;"JAKARTA, KOMPAS.com  — Badan Pengawas Pemilu DKI Jakarta memutuskan pemasangan videtron kampanye pasangan Calon Presiden dan Wakil Presiden Nomor Urut Satu Joko Widodo-Ma'ruf Amin melanggar administrasi pemilu.Bawaslu menilai tayangan   videotron  itu melanggar Surat Keputusan KPU DKI Jakarta No 175 Tahun 2018 karena dipasang di tempat-tempat yang seharusnya steril dari alat peraga kampanye.""Pemasangan alat peraga kampanye berupa videotron yang memuat pasangan calon nomor urut 1 di Jalan MH Thamrin, Jakarta Pusat; Taman Tugu Tani, Jakarta Pusat; Jalan Menteng Raya, Jakarta Pusat; Jalan Gunung Sahari Raya, Jakarta Pusat, berada pada tempat yang dilarang pada SK KPU Provinsi DKI Jakarta Nomor 175,"" kata Ketua Majelis Sidang Puadi di Kantor Bawaslud DKI, Jumat (26/10/2018).Baca juga:  Pelapor Serahkan Berkas Kesimpulan Kasus Videotron Jokowi-MarufDalam putusannya,   Bawaslu DKI  Jakarta memerintahkan Dinas Penanaman Modal dan Pelayanan Terpadu Satu Pintu untuk menghentikan tayangan videotron tersebut serta mengingatkan pemilik videotron supaya tidak menayangkan kembali materi kampanye di tempat terlarang sesuai SK KPU No 175 Tahun 2018.Dalam putusannya pula, Bawaslu DKI Jakarta menolak sebagian tuntutan pelapor atas nama seorang warga bernama Sahroni.Tuntutan Sahroni yang ditolak adalah teguran terhadap Jokowi-Ma'ruf dan permintaan Jokowi-Ma'ruf meminta maaf secara tertulis pada Pasangan Nomor Urut Dua Prabowo Subianto-Sandiaga Uno.Baca juga:  Soal Videotron, Tim Jokowi-Maruf Merasa Bawaslu DKI Tak Adil""Itu ditolak karena tidak ada bukti, tidak bisa dibuktikan dalam fakta-fakta persidangan. Makanya, kita tolak karena di dalam fakta-fakta persidangannya tidak ada,"" kata Puadi setelah sidang.Sebelumnya, Jokowi-Ma'ruf dilaporkan oleh Sahroni karena diduga memasang alat peraga kampanye berupa tayangan videotron di jalan-jalan protokol yang mestinya steril dari alat peraga kampanye.Baca juga:  Bawaslu Sebut Sidang Videotron Jokowi-Maruf Bisa Jalan Terus Tanpa Surat Kuasa Terlapor"
Ibu dan Anak Tewas Dibunuh Rampok, Pelaku Menyerahkan Diri;Kontributor Pekanbaru, Idon Tanjung;"PEKANBARU, KOMPAS.com  - Seorang ibu rumah tangga (IRT), Diana (55) dan anaknya Putri (18)   tewas    dibunuh  seorang pelaku   perampokan  di Jalan Garuda Sakti, Desa Karya Indah, Kecamatan Tapung, Kabupaten Kampar,   Riau.Pelaku menyerahkan diri kepada polisi.""Pelaku berinisial ED (41) menyerahkan diri di Polsek Tampan setelah kabur ke Pekanbaru. Saat ini pelaku diamankan di Polda Riau,"" kata Kapolres AKBP Andri Ananta Yudhistira pada wartawan, Jumat (26/10/2018).Dia menambahkan, pelaku mau menyerahkan diri setelah dibujuk oleh pihak keluarga.Saat itu, pelaku berada di Simpang Beringin wilayah perbatasan Pekanbaru-Kabupaten Pelalawan. Pelaku membawa sejumlah hasil aksi perampokan.Andri menjelaskan, pelaku melakukan aksi perampokan di rumah korban pada Kamis (25/10/2018) dini hari sekitar pukul 01.30 WIB.""Pelaku ini adalah tetangga korban. Dalam aksinya, pelaku masuk ke dalam rumah korban dengan cara memanjat dinding belakang,"" ujar Andri.Baca juga:  Hasil Perampokan Minimarket di Tangerang Akan Digunakan Pelaku untuk Judi OnlineSetelah masuk di rumah korban, lanjutnya, pelaku kembali keluar mengambil sepotong kayu pohon rambutan berukuran 80 sentimeter dan masuk lagi ke rumah korban menuju ruangan tengah.Anak korban bernama Putri tiba-tiba bangun dari tidur menuju ruang tengah dan melihat pelaku.""Pelaku langsung memukul sang anak sebanyak tiga kali di bagian kepala. Ibunya (Diana) langsung terbangun dan menghampiri anaknya. Saat itu pelaku juga langsung memukuli korban hingga meninggal dunia,"" ujar Andri.Usai membunuh kedua korban, pelaku mengambil barang-barang korban berupa ponsel, laptop dan membawa kabur mobil korban.Sebelum menyerahkan diri, pelaku kabur ke wilayah Kecamatan Tenayan Raya, Pekanbaru. Saat itu pelaku memarkirkan mobil hasil rampok disebuah ruko. Pelaku kemudian menghubungi temannya untuk menjemputnya.Sekitar pukul 03.00 WIB temannya datang menggunakan sebuah mobil bersama seorang wanita, lalu pelaku diantar sampai ke Simpang Beringin, wilayah perbatasan Kabupaten Pelalawan.Selanjutnya pelaku menghubungi teman wanitanya berinisial ER yang tinggal di sekitar wilayah tersebut. Setelah bertemu, mereka pergi jalan-jalan menggunakan sepeda motor.Sementara itu, pihak kepolisian sudah membentuk tim terdiri dari Polres Kampar, Polsek Tapung dan Jatanras Polda Riau.""Sekitar pukul 18.30 WIB, pelaku dijemput keluarganya dan membujuk pelaku untuk menyerahkan diri. Akhirnya, sekitar pukul 19.30 WIB, pelaku menyerahkan diri melalui Polsek Tampan di Pekanbaru,"" jelas Andri.Sementara barang bukti yang diamankan, satu unit mobil Toyota Innova BM 1059 LN beserta BPKB, sepotong kayu, satu buah rantai besi dan gembok serta satu buah kotak ponsel."
Lukisan Hasil Program Kecerdasan Buatan Terjual Rp 6,5 Miliar;Veronika Yasinta;"NEW YORK, KOMPAS.com  -   Lukisan  yang dibuat berdasarkan   alogaritma  berhasil melampaui batas dengan terjual 432.500 dollar AS atau Rp 6,5 miliar di balai lelang Christie, New York, Amerika Serikat.Lukisan potret itu menjadi karya seni lukis pertama yang dihasilkan oleh  Artificial Intelligence  atau   kecerdasan buatan.Diwartakan  AFP , Kamis (25/10/2018),   lukisan  berjudul  Edmond de Belamy  tersebut memperlihatkan potret seorang pria berpakaian hitam.Baca juga:  5 Hal Mengejutkan yang Tak Disangka Bisa Dilakukan Kecerdasan BuatanLukisan dibingkai dengan warna emas, sesuatu yang biasa menjadi standar dari abad 18 atau 19.Namun jika dilihat dari dekat, gambar nampak lebih menarik. Wajahnya memang kabur dan lukisannya seakan belum selesai. Pada bagian kanan bawah, terdapat cap rumus matematika.Lukisan ini digagas oleh kolektif Perancis, Obvious, yang bertujuan untuk menggunakan kecerdasan buatan dalam membuat karya seni.Untuk membuat lukisan itu, seniman Pierre Fautrel memasukkan data 15.000 potret klasik melalui perangkat lunak komputer.Setelah perangkat lunak memahami aturan potret, algoritma baru yang dikembangkan oleh peneliti Google Ian Goodfellow, menghasilkan serangkaian gambar baru dengan sendirinya.Awalnya, lukisan diperkirakan hanya akan terjual seharga 7.000 dollar AS hingga 10.000 dollar AS atau maksimal sekitar Rp 152 juta.Baca juga:  Biografi Tokoh Dunia: Pablo Picasso, Pelukis RevolusionerKini, pertanyaannya adalah, apakah itu termasuk seni? Fautrel menjawabnya dengan tegas bahwa lukisan tersebut merupakan karya seni.""Bahkan jika algoritma itu menciptakan gambar,"" katanya.""Lami adalah orang-orang yang memutuskan untuk melakukan ini, yang memutuskan untuk mencetaknya di kanvas, menandatanganinya dengan rumus matematika, menaruhnya dalam bingkai emas,"" imbuhnya."
Pundi-pundi Kekayaan 4 Kepala Daerah dan Upeti Jual Beli Jabatan;Abba Gabrillin;JAKARTA, KOMPAS.com  -Komisi Pemberantasan Korupsi (KPK) kembali membongkar kasus korupsi dengan modus   jual beli jabatan  di lingkungan pemerintah daerah. Kali ini, KPK menangkap tangan Bupati Cirebon Sunjaya Purwadi Sastra.Sunjaya diumumkan sebagai tersangka pada Kamis (25/10/2018). Sunjaya Purwadisastra diduga mematok setoran dalam mutasi jabatan di lingkungan Pemerintahan Kabupaten Cirebon.Baca juga:  OTT Kepala Daerah di Cirebon Diduga Terkait Jual Beli JabatanMenurut Febri, KPK saat ini baru mengidentifikasi satu orang yang diduga memberikan fee kepada Sunjaya atas mutasi jabatan.Satu orang tersebut adalah Sekretaris Dinas Pekerjaan Umum dan Penataan Ruang (PUPR) Gatot Rachmanto.Gatot diduga memberikan uang sebesar Rp 100 juta atas mutasi dan pelantikannya sebagai Sekretaris Dinas PUPR.Sunjaya bukan yang pertama kali. Setidaknya ada tiga   kepala daerah  lainnya yang harus berurusan dengan KPK karena modus korupsi jual beli jabatan.1. Bupati Klaten Sri HartiniSri juga dihukum membayar denda Rp 900 juta subsider 10 bulan kurungan.Majelis hakim menyatakan, Hartini terbukti menerima suap dan gratifikasi dalam empat kasus yang menjeratnya.Perbuatannya dinilai tidak mendukung upaya Pemerintah memberantas tindak korupsi.Sri dinilai terbukti mendapat uang suap dan gratifikasi sebesar Rp 12,887 miliar.Suap dan gratifikasi terdiri dari beragam kasus mulai dari jual beli jabatan, pemotongan bantuan dana desa, mutasi dan promosi kepala sekolah SMP dan SMA, mutasi PNS di Setda Pemkab Klaten hingga pengisian jabatan di PDAM, rumah sakit, dan intansi terkait.2. Bupati Nganjuk TaufiqurrahmanUang itu diduga terkait perekrutan dan pengelolaan aparatur sipil dan pegawai negeri sipil di Kabupaten Nganjuk tahun 2017.Suap terhadap Taufiq diduga terkait pengisian sejumlah posisi seperti kepala sekolah SD, SMP, dan SMA.Orang-orang yang akan menjabat posisi tertentu diharuskan untuk memberi uang kepada pejabat setempat.Pada Juni 2018, majelis hakim Pengadilan Tipikor Surabaya menjatuhkan hukuman penjara selama tujuh tahun dan denda sebesar Rp 350 juta kepada Taufiq.3. Bupati Jombang Nyono Suharli WihandokoNyono diduga menerima suap dari Plt Kepala Dinas Kesehatan Kabupaten Jombang Inna Silestyanti.Suap tersebut diberikan oleh Inna agar Nyono, selaku bupati, menetapkan Inna sebagai Kepala Dinas Kesehatan definitif.Total suap yang diberikan kepada Nyono berjumlah Rp 275 juta. Uang yang diberikan kepada Nyono, berasal dari kutipan jasa pelayanan kesehatan dana kapitasi BPJS dari 34 puskesmas di Jombang.Dana tersebut telah dikumpulkan oleh Inna sejak Juni 2017.Pada September 2018, Nyono Suharli Wihandoko divonis 3,5 tahun oleh majelis hakim Pengadilan Tindak Pidana Korupsi Surabaya.Dia juga dihukum membayar denda Rp 200 juta dan dicabut hak politiknya selama 3 tahun setelah selesai menjalani pidana pokok.
