title;author;content
Teka-teki 2 Nama Cawagub DKI yang Disepakati Gerindra dan PKS;Jessi Carina;"JAKARTA, KOMPAS.com -  Partai Gerindra dan Partai Keadilan Sejahtera (PKS) diam-diam sudah bersepakat tentang dua nama calon wakil gubernur DKI Jakarta pengganti Sandiaga Uno. Hal ini diungkapkan anggota Majelis Syuro DPP PKS Triwisaksana saat ditemui di Gedung DPRD DKI Jakarta, Jalan Kebon Sirih, Kamis (25/10/2018).""Rasanya sudah disetujui bersama terkait dua namanya, tetapi belum bisa disampaikan. Yang jelas nama itu sudah mengerucut. Komposisinya dua orang ini insya Allah sudah disepakati Gerindra dan PKS,"" kata Triwisaksana.Ia mengatakan, nama dua orang tersebut tidak jauh dari yang beredar selama ini. Catatan  Kompas.com,  nama-nama yang beredar sejauh ini ada empat. Dari PKS, ada nama Agung Yulianto dan Ahmad Syaikhu. Sementara dari Gerindra, ada nama   Mohamad Taufik  dan Rahayu Saraswati Djojohadikusumo.Baca juga:  Kata Triwisaksana soal 2 Nama Cawagub DKI yang Disepakati PKS dan GerindraTriwisaksana tidak mau memberi penjelasan lebih lanjut tentang siapa dua calon itu. Masih menjadi teka-teki juga apakah dua orang itu masing satu dari PKS dan Gerindra, atau dua-duanya dari PKS atau Gerindra. Selama ini PKS dan Gerindra kerap berselisih soal itu.PKS beberapa bulan terakhir berkeras untuk mendapatkan jabatan wagub. Mereka mengacu pada perjanjian antara Ketua Umum Partai Gerindra Prabowo Subianto dan Presiden PKS Sohibul Iman bahwa posisi cawapres diberikan ke Gerindra, tetapi posisi wagub DKI untuk PKS.PKS sudah menyiapkan dua kader untuk diajukan ke Gubernur DKI. Keinginan PKS itu bertentangan dengan Gerindra DKI Jakarta yang juga ingin mencalonkan wagub. Ketua DPD Partai Gerindra DKI Mohamad Taufik telah digadang-gadang menjadi cawagub pengganti Sandiaga.Namun entah bagaimana, kesepakatan antara dua partai itu akhirnya tercipta juga. Sani mengatakan bagaimanapun komposisi dua nama cawagub itu telah disepakati oleh PKS dan Gerindra.""Yang penting sudah ada kemajuan saat ini. Gerindra dan PKS tidak mau hanya memikirkan ego pribadi dengan tarik menarik figur terus tapi juga memikirkan kepentingan DKI,"" ujar Sani.Ucapan PrabowoDua hari sebelumnya, Prabowo Subianto mengeluarkan pernyataan terkait penentuan wagub DKI. Dia mengatakan, urusan itu dia serahkan kepada Mohamad Taufik yang merupakan pimpinan Gerindra Jakarta.""Tenang aja,  you  tunggu waktunya pengumuman. Tanya Pak Taufik lah siapa. Ketua Gerinda Jakarta namanya Muhammad Taufik,"" ujar Prabowo.Baca juga:  Semakin Mengerucut, PKS dan Gerindra Sepakati 2 Nama Cawagub DKIBeberapa orang beranggapan bahwa Prabowo sudah menyetujui Taufik diajukan sebagai cawagub. Taufik sendiri menyebut pernyataan Prabowo adalah ""pertanda bagus"".Namun, Sani atau Triwisaksana memaknai pernyataan itu dengan berbeda. Menurut dia pernyataan Prabowo menunjukkan bahwa urusan wagub itu sudah diserahkan kepada pimpinan partai di tingkat Provinsi DKI Jakarta.Artinya, baik Prabowo maupun Sohibul Iman sudah memiliki kesepakatan juga. Kemudian kesepakatan itu diteruskan ke pengurus tingkat DKI Jakarta untuk dijalankan. PKS DKI dan Gerindra DKI diminta segera menyelesaikan teknis pengumuman calonnya.""Saya kira Pak Prabowo sudah tepat menyampaikan itu bahwa soal   cawagub DKI  adalah urusan masing-masing DPD baik Gerindra atau PKS,"" ujar Sani.""Jadi tinggal menunggu kesepakatan bersama dari Pak Taufik dan Pak Syakir (Ketua DPW PKS DKI) untuk segera mengumumkan dan mengajukan nama cawagub DKI,"" tambah dia.Di sisi lain saat dihubungi, Mohamad Taufik terdengar tidak seyakin biasanya ketika ditanya tentang pencalonan dirinya. Dia hanya menjawab bahwa urusan wagub akan dibahas pekan depan.""Kita minggu depan akan mengundang resmi, bersurat ke PKS untuk membahas itu,"" kata Taufik.Jika klaim bahwa dua nama kandidat itu benar, itu berarti proses penentuan cawagub mulai ada kemajuan. Kini tinggal menunggu PKS dan Gerindra mengumumkan siapa dua calon yang akan diusung itu."
Selama Disekap Ekstremis Suriah, Jurnalis Jepang Dilarang Gaduh dan Bergerak;Veronika Yasinta;"TOKYO, KOMPAS.com  -   Jurnalis  asal   Jepang  yang ditawan kelompok   ekstremis    Suriah  selama 40 bulan kini dapat bernafas lega.Meski mendapat cercaan karena dalam video yang dirilis kelompok tersebut dia mengaku sebagai warga negara Korea Selatan, Jumpei Yasuda dapat kembali ke Jepang pada Kamis (25/10/2018) malam.Mengutip  Reuters  dari  Straits Times , Yasuda menceritakan pengalamannya selama berada dalam tahanan.Baca juga:  Jurnalis Jepang: 3 Tahun Disekap Rasanya Seperti di NerakaDia dilarang untuk bergerak atau berisik bahkan ketika tidur sekali pun.Selama 8 bulan, Yasuda harus tinggal dalam kurungan berukuran 1,5 meter x 1 meter. Dia tidak diizinkan untuk mandi, mencuci baju, atau gaduh.""Karena saya tidak mencuci rambut saya, kepala saya gatal. Tapi ketika saya menggaruk, itu membuat berisik,"" ucapnya kepada surat kabar Asahi Shimbun saat penerbangan pulang ke Jepang.""Bernapas dengan hidung, menggeretakkan jari, bergerak saat tidur, itu semua dilarang,"" imbuhnya.Dia tidak makan selama 20 hari sebagai upaya untuk mencegah melakukan gerakan apa pun.""Tinggal kulit dan tulang saja, sangat mual. Jika lebih lama lagi, mungkin saya akan mati, tetapi akhirnya saya pindah ke tempat yang berbeda,"" ujar Yasuda.""Mereka tidak memberikan saya makanan, atau jika mereka memberi saya makanan kaleng, mereka tidak akan membawa pembuka kaleng,"" katanya.Sebelum Yasuda menginjakkan kaki di Jepang, dia menjadi target kemarahan warganet karena menyebut dirinya bukan warga Jepang.""Dia menganggu masyarakat,"" tulis seorang pengguna Twitter.""Dia anti warga-negara,"" tulis yang lain.Baca juga:  Jepang Pastikan Jurnalis yang Ditahan di Suriah sejak 2015 Telah DibebaskanMenanggapi kritikan tersebut, Yasuda mengeluarkan pernyataan yang dibacakan oleh istrinya, Myu.""Saya minta maaf karena membuat masalah dan kekhawatiran, tapi terima kasih untuk kalian semua, saya dapat pulang ke rumah dengan selamat,"" ucapnya.Saat sampai di Jepang, Yasuda disambut oleh sang istri dan orangtuanya, yang membawa makanan rumahan Jepang untuk merayakan kepulangannya."
Pendidikan Anak Usia Dini, Apa yang Harus Dicermati oleh Orangtua?;Alek Kurniawan;KOMPAS.com –    Pendidikan anak  usia dini sejatinya adalah sebuah investasi jangka panjang untuk anak meraih kesuksesan di masa mendatang. Berkaca pada hal itu, setiap orangtua tentu menginginkan pendidikan terbaik untuk buah hatinya.Pertanyaan yang kemudian mengemuka adalah, bagaimana cara orangtua memilih lembaga   pendidikan anak  usia dini atau  pre-school  yang tepat untuk putra-putrinya? Serta faktor apa saja yang harus dicermati dalam pemilihan tersebut?Pada dasarnya, melansir artikel Kompas.com pada Jumat, (22/1/2016), pendidikan terbaik akan dapat diperoleh anak ketika metode dan sistem pembelajaran di kelas sesuai dengan gaya belajar mereka.Oleh karena itu sebelum menentukan pilihan sekolah mana yang akan dimasuki, sebaiknya orangtua harus terlebih dahulu mengetahui kemampuan dan kebutuhan si buah hati. Hal ini untuk memastikan anak dapat mengikuti proses pembelajaran dengan menyenangkan tanpa merasa tertekan.Kemudian, setelah itu barulah orangtua bisa melihat faktor lainnya yang wajib dicermati saat menentukan  pre-school  untuk anak. Berikut pembahasannya.1. Tenaga pendidik yang cakapBaik atau tidaknya kualitas  pre-school  yang akan dipilih bisa dilihat lewat tenaga pendidiknya. Kerap disebutkan bahwa tenaga pendidik atau guru adalah ujung tombak yang menentukan anak akan belajar dan bermain dengan menyenangkan atau tidak.Selain harus memiliki  background  pendidikan yang sesuai, seorang guru juga harus cakap dalam memberikan pengajaran yang baik agar mereka nyaman berada di kelas.“Hal utama yang harus dilakukan guru adalah membuat anak didik nyaman terlebih dahulu berada di kelas. Jika hal tersebut sudah tercapai, maka mereka akan memiliki rasa  trust  kepada guru sehingga pembelajaran menjadi lebih optimal,” ungkap Koordinator Guru Early Years Sinarmas World Academy, Len kepada Kompas.com, Jumat (6/10/2018).Lebih lanjut, seorang guru juga harus pandai melihat perkembangan dan hal apa saja yang dibutuhkan anak. Terlebih bila anak memiliki masalah dalam proses belajar mengajar di kelas. Guru yang baik akan mengkomunikasikan kepada orangtua tentang perkembangan maupun kendala-kendala yang mungkin saja dihadapi si buah hati.2. Lingkungan sekolahHal selanjutnya yang harus dicermati dalam memilih  pre-school  adalah lingkungan sekolah ( environment ) itu sendiri. Perhatikan, apakah sekolah memiliki sarana dan prasarana yang memadai atau tidak?Selain itu cermati juga ruang belajar anak didik. Melansir artikel Kompas.com, Senin (21/5/2018), ruang belajar yang baik bagi siswa  pre-school  harus memiliki furnitur yang sesuai ukuran dengan tubuh anak-anak. Dengan begini mereka bisa mengambil barang yang dibutuhkannya sendiri tanpa bergantung kepada orang dewasa.“Hal ini supaya anak didik dapat lebih nyaman berada di kelas dan guru bisa melihat perkembangan masing-masing anak dengan lebih fokus,” jelasnya kepada Kompas.com.3. Nilai dasar atau filosofi sekolahSetiap sekolah mempunyai nilai dasar dan filosofinya masing-masing. Meskipun secara kasat mata komponen ini tidak banyak diperhatikan oleh orangtua, tetapi nyatanya hal ini sangat penting. Sebab, nilai dasar dan filosofi sekolah menentukan bagaimana budaya belajar mengajar di kelas berlangsung.Hal terpenting yang harus Anda lakukan sebagai orangtua adalah kenali terlebih dahulu nilai-nilai dasar yang dipegang teguh oleh sekolah. Kemudian, sesuaikan pula dengan kebutuhan anak Anda, apakah kepribadian dan gaya belajar si anak cocok atau tidak.4. Penggunaan kurikulumKurikulum dan pembelajaran merupakan satu kesatuan yang saling mendukung dalam sebuah pendidikan. Kurikulum yang tepat akan dapat memberikan pembelajaran yang sesuai sehingga proses belajar mengajar pun akan berjalan lancar.Oleh karena itu, penting hukumnya menerapkan kurikulum yang tepat untuk menciptakan pendidikan yang berkualitas. Hal ini seperti yang diterapkan oleh Sinarmas World Academy (SWA).“Pada   pendidikan anak usia dini , ada beberapa tahapan berbeda yang dimiliki anak sesuai usianya. Dalam hal ini berarti beda usia maka beda  skills  juga yang akan dipelajari,” ungkap Kelly.Melihat fakta tersebut, SWA menggunakan dua kurikulum yang berbeda sesuai dengan tahapan usia anak, yakni Early Years Foundation Stage (EYFS) dan Cambridge Primary Curriculum Stage 1.Pada tahap ini peserta didik difokuskan pada empat area pembelajaran, seperti pendidikan literasi, matematika dasar, seni dan desain ekspresif, serta pengetahuan dasar komputer dan robotik.Setelah anak bertambah usia pada rentang 5-6 tahun, lanjut Kelly, mereka akan masuk ke dalam kelas Kindergarten 2.“Pada kelas ini kami menggunakan Cambridge Primary Curriculum Stage 1 yang berfokus pada persiapan peserta didik masuk ke jenjang berikutnya, yakni sekolah dasar,” ujarnya lagi.Pembelajaran komputasi matematika mulai dikenalkan di kelas ini. Selain itu, pelajaran ilmu pengetahuan alam, bahasa Inggris, bahasa Mandarin, dan kesenian juga mulai difokuskan.Selain pentingnya keberadaan kurikulum, ternyata peran orangtua terhadap perkembangan  anak usia dini di sekolah juga mempunyai posisi yang strategis.“Orangtua harus berlaku  supportive, cooperative,  dan  open minded  dalam pendidikan anak usia dini. Selain itu, komunikasi yang apik juga harus terjalin antara orangtua dan guru, jadi terjalin hubungan yang terbuka,” ujar Kelly.Dengan begitu, diharapakan siswa usia dini bisa mendapatkan pendidikan yang berkualitas sebagai bekal untuk mengecap pendidikan selanjutnya.
ICW: Praktik Jual-Beli Jabatan seperti Lingkaran Setan Korupsi;Devina Halim;"JAKARTA, KOMPAS.com  - Wakil Koordinator Indonesia Corruption Watch (  ICW ) Ade Irawan menyebutkan bahwa praktik suap dengan modus jual/beli jabatan memiliki pola seperti lingkaran setan   korupsi .Ia menjelaskan, modus praktik ini secara umum adalah suap dan pemerasan. Menurut Ade, prosesnya seperti melakukan tender, tetapi terkait jabatan tertentu.""Modusnya macam tender suap, pemberi suap paling besar, dia yang akan dipilih,"" ujarnya ketika dihubungi oleh  Kompas.com , Jumat (26/10/2018).Nilai dari jabatan tersebut akan bergantung pada seberapa strategis posisi itu. Ade menuturkan, semakin besar anggaran yang dikelola oleh pemegang jabatan tersebut, nilai posisi tersebut pun akan semakin tinggi.Baca juga:  Suap Jual Beli Jabatan di Cirebon Mulai Rp 50 Juta hingga Rp 200 JutaHal itu akan membuka peluang terjadinya korupsi.   Pejabat  tersebut dapat melakukan korupsi terhadap proyek yang dikelolanya untuk mempertahankan jabatannya tersebut.""Suap jabatan jadi awalan korupsi. Karena selanjutnya, supaya si   pejabat  tetap dengan jabatannya (tidak dimutasi atau  no-job ), harus terus setor,"" terangnya.""Modal untuk setor ya dari korupsi proyek yang dikelola lembaga di lingkungannya. Jadi akan menjadi semacam lingkaran setan korupsi,"" imbuh dia.Ada beberapa hal yang menjadi penyebab praktik tersebut, mulai dari ingin memperkaya diri hingga mengembalikan modal pada saat proses pemilihan.Baca juga:  Kronologi Penangkapan Bupati Cirebon oleh Penyidik KPKUntuk itu, ia pun menyarankan diberlakukannya lelang jabatan agar prosesnya berjalan adil dan terbuka.Ade juga menyebutkan pentingnya proses pemilihan kepala daerah yang berintegritas dan terbebas dari segala bentuk mahar politik.Aspek pengawasan juga menjadi salah satu hal penting, yang dapat dilakukan melalui Komisi Aparatur Sipil Negara (KASN).Baru-baru ini, praktik tersebut diduga dilakukan oleh Bupati Cirebon Sunjaya Purwadisastra. Ia merupakan salah satu orang yang terjaring dalam Operasi Tangkap Tangan (OTT) yang dilakukan oleh Komisi Pemberantasan   Korupsi  (KPK) di Cirebon.Petugas KPK menemukan uang miliaran rupiah yang merupakan barang bukti atas dugaan transaksi suap.Ketua KPK Agus Rahardjo mengatakan, penangkapan ini diduga terkait jual beli jabatan di lingkungan pemerintah daerah."
Jalan Panjang Kasus Frantinus Nirigi (3);Kontributor Pontianak, Yohanes Kurnia Irawan;"PONTIANAK ,KOMPAS.com -Menurut  Bruder Stephanus Paiman dari Forum Relawan Kemanusiaan   Pontianak  (FRKP) dan JPIC Kapusin , penerjemah dari Lion Air menambah dan mengurangi terjemahan, sehingga banyak yang terkesan mengada-ada.""Karena kami juga bawa orang yang fasih bahasa Inggris, sehingga tahu apa yang disampaikan oleh penerjemah dari Lion Air itu,"" ucapnya.     Kemudian, pada saat kuasa hukum ingin menghadirkan saksi ahli, dimentahkan oleh hakim dengan alasan saksi dari jaksa penuntut umum sudah banyak dan waktu penahanan sudah terlalu lama.     ""Ketua majelis hakim mengatakan agar kuasa hukum lebih baik mempersiapkan   banding  atau kasasi, padahal tahapan sidang lainnya seperti pledoi, replik, duplik serta putusan blm ada,"" ungkap Biarawan Kapusin ini.Baca juga:  Sidang Frantinus Nirigi, PN Mempawah Disebut Tak Berwenang Mengadili""Artinya pernyataan ketua majelis ini kita sudah tau bahwa Frans kalah dan siap-siap dihukum penjara,"" tambahnya.    Stephanus menambahkan, yang mengejutkan adalah pada saat kuasa hukum mengajukan agar menghadirkan saksi yang meringankan yang ada didalam BAP, majelis hakim menanyakan apakah kuasa hukum punya duit atau tidak.     ""Ada hal yg ditabrak Ketua Majelis Hakim, beliau bertanya kepada pengacara terdakwa, saudara punya duit enggak. Pertanyaan ini karena pengacara terdakwa minta agar saksi yang di BAP harus dihadirkan,"" papar Stepanus.     ""Terutama saksi yang meringankan terdakwa. Saksi yg di BAP tersebut, wajib dihadirkan Jaksa Penuntut Umum. Tetapi faktanya, saksi yang akan meringankan terdakwa tidak dihadirkan, tetapi saksi yg hanya 'katanya' dihadirkan Jaksa dalam persidangan,"" pungkas Stephanus.Bruder Stephanus Paiman mengatakan, pihaknya akan segera mengumpulkan berkas-berkas persidangan termasuk hasil putusan dan diserahkan ke KY untuk dipelajari.“Saya akan melaporkan putusan ini pada Komisi Yudisial (KY) dengan bukti-bukti persidangan, karena dari awal kasus ini dipaksakan, terlihat penuh kejanggalan,” ujarnya.    Bruder Step mengatakan bahwa pihaknya sudah berkomunikasi dengan KY untuk menindaklanjuti hasil putusan tersebut."
"Timses Prabowo-Sandiaga: ""Undecided Voters"" Tak Yakin dengan Presiden Jokowi";Kristian Erdianto;"JAKARTA, KOMPAS.com  - Anggota Direktorat Advokasi dan Hukum Badan Pemenangan Nasional (BPN) Ferdinand Hutahaean menilai bahwa elektabilitas pasangan capres-cawapres nomor urut 02 Prabowo Subianto berpotensi unggul dari pasangan Joko Widodo-Ma'ruf Amin pada Pilpres 2019.Ferdinand mengatakan, meski hasil survei Litbang Kompas menunjukkan elektabilitas Jokowi unggul, namun posisinya belum aman karena jumlah  undecided voters  masih tinggi.""Survei tersebut menunjukkan bahwa Jokowi sekarang di atas kertas menang, tapi tidak aman karena  undecided voters  masih tinggi,"" ujar Ferdinand saat dihubungi, Jumat (26/10/2018).Baca juga:  Pendukung Militan, Kubu Prabowo-Sandiaga Yakin Bisa Tingkatkan ElektabilitasBerdasarkan hasil survei terbaru Litbang Kompas yang digelar pada 24 September-5 Oktober 2018, menunjukkan adanya kemungkinan para pendukung kedua pasangan yang berpotensi menggeser arah dukungan.Sebanyak 30,7 persen pemilih Jokowi-Ma’ruf yang masih berpeluang mengubah dukungannya hingga pemilu nanti. Kemungkinan serupa pada pasangan   Prabowo-Sandiaga  sebesar 34,2 persen.Dengan adanya pemilih ragu pada kedua belah pihak dan mereka yang hingga kini belum menentukan pilihan sebesar 14,7 persen, maka total massa mengambang dapat mencapai 46,8 persen.Baca juga:  Elektabilitas Prabowo-Sandiaga Turun Pasca Kasus Ratna Sarumpaet, Apa Kata Ketum PAN?Ferdinand meyakini  undecided voters  berasal dari kalangan pemilih yang sudah tidak yakin dengan kepemimpinan Presiden Jokowi.""Maka yang akan kami lakukan adalah meyakinkan mereka dengan janji, terutama mengoreksi semua kebijakan rezim Jokowi yang tidak tepat dan menjadi beban rakyat,"" kata Ferdinand."
Gempa 6,8 Magnitudo di Yunani, Getaran Terasa Sampai Italia dan Albania;Veronika Yasinta;"ATHENA, KOMPAS.com  -   Gempa  berkekuatan 6,8 magnitudo melanda pesisir   Yunani  pada Jumat (26/10/2018).Badan Survei Geologi AS (USGS) mencatat,   gempa  itu mengguncang pulau wisata Zante atau dikenal juga sebagai Zakynthos, di   Laut Ionia  pada pukul 01.50 waktu setempat.Melansir  Daily Express , pusat gempa terletak di Laut Ionia, dekat pulau Zante, dengan kedalaman sekitar 16 km.USGS menyebut ada potensi tsunami kecil sehingga penduduk diminta untuk menjauhi pantai.Baca juga:  Selamat dari Gempa Palu, Atlet Paralayang Singapura Tewas di India saat BeraksiLembaga itu mengklaim sebanyak 19,3 juta orang kemungkinan merasakan gempa, termasuk 54.000 orang yang merasakan gempa sangat kuat.""Beberapa kerusakan dimungkinkan dan dampaknya harus dilokalisir secara relatif,"" tulis USGS.Getaran gempa dilaporkan juga terasa hingga   Italia  dan   Albania.""Saya dan rekan saya tinggal di Zante, dan rekan saya terbangun. Ada tiga gempa susulan namun lebih kecil, gempa yang besar menggerakkan beberapa benda di kamar,"" tulis seorang saksi mata di media sosial.Pusat Seismologi Eropa-Mediterania (EMSC) mengatakan, seorang saksi mata menyebut getaran gempa sangat kuat hingga menjatuhkan benda dari rak.Menurut keterangan saksi mata, gempa berlangsung selama 15 hingga 30 detik.Pemadam kebakaran Yunani menyatakan belum ada laporan mengenai kerusakan di pulau tersebut.Baca juga:  Gempa 6,0 Magnitudo Guncang TaiwanNamun, sebagian dinding gereja ambruk di kota utama Pyrgos, bagian selatan area Peloponnese. Media lokal melaporkan, sebuah biara abad ke-15 di daerah Strofades di pulau itu telah rusak.Yunani terletak di salah satu wilayah paling rawan gempa di dunia, dan ribuan gempa tercatat setiap tahunnya.Sementara, situs berita Italia,  Il Messaggero , melaporkan gempa tersebut dirasakan hingga Italia selatan.Petugas pemadam kebakaran di daerah Sisilia, Calabria, dan Puglia menerima ribuan panggilan telepon setelah gempa melanda."
"Strategi Kubu Prabowo-Sandiaga Menggaet Suara dari ""Undecided Voters""";Kristian Erdianto;"JAKARTA, KOMPAS.com  - Anggota Direktorat Advokasi dan Hukum Badan Pemenangan Nasional (BPN) Prabowo Subianto-Sandiaga Uno Ferdinand Hutahaean menuturkan, pihaknya berupaya menggaet  undecided voters  atau pemilih yang belum menentukan pilihan untuk meningkatkan elektabilitas pasangan nomor urut 02 itu.Menurut Ferdinand, pemilih yang belum menentukan pilihan berasal dari kalangan masyarakat yang sudah tidak yakin dengan kepemimpinan Presiden Joko Widodo. Namun belum yakin untuk memilih Prabowo Subianto.Terkait hal itu, kata Ferdinand, BPN akan meyakinkan undecided voters dengan strategi mengoreksi kebijakan pemerintah yang justru menjadi beban masyarakat.Baca juga:  Pendukung Militan, Kubu Prabowo-Sandiaga Yakin Bisa Tingkatkan Elektabilitas""Maka yang akan kami lakukan adalah meyakinkan mereka dengan janji, terutama mengoreksi semua kebijakan rezim Jokowi yang tidak tepat dan menjadi beban rakyat,"" ujar Ferdinand saat dihubungi, Jumat (26/10/2018).Politisi Partai Demokrat itu mencontohkan berbagai kritik dari BPN pasangan   Prabowo-Sandiaga  terhadap pemerintah, khususnya di bidang ekonomi.Ferdinand berpendapat bahwa sebagian besar kebijakan pemerintahan Presiden Jokowi justru membuat perekonomian Indonesia terpuruk.""Maka kami akan mengoreksi semua kesalahan itu sehingga undecided voters akan memilih Prabowo karena datang dengan semangat arus perubahan, memperbaiki yang salah dan meningkatkan ekonomi yang sudah terlanjur terpuruk di era Jokowi,"" kata Ferdinand.Berdasarkan hasil survei terbaru Litbang Kompas yang digelar pada 24 September-5 Oktober 2018, elektabilitas pasangan Joko Widodo-Ma'ruf Amin mencapai 52,6 persen dalam   Pilpres 2019 . Sementara pasangan Prabowo Subianto-Sandiaga Salahuddin Uno mendapat 32,7 persen.Baca juga:  Timses Prabowo-Sandiaga: Undecided Voters Tak Yakin dengan Presiden JokowiSurvei tersebut juga menunjukkan adanya kemungkinan para pendukung kedua pasangan yang berpotensi menggeser arah dukungan.Sebanyak 30,7 persen pemilih Jokowi-Ma’ruf yang masih berpeluang mengubah dukungannya hingga pemilu nanti. Kemungkinan serupa pada pasangan Prabowo-Sandiaga sebesar 34,2 persen.Dengan adanya pemilih ragu pada kedua belah pihak dan mereka yang hingga kini belum menentukan pilihan sebesar 14,7 persen, maka total massa mengambang dapat mencapai 46,8 persen."
